{
    "func_name": "xdp_umem_reg",
    "func_src_before": "static int xdp_umem_reg(struct xdp_umem *umem, struct xdp_umem_reg *mr)\n{\n\tbool unaligned_chunks = mr->flags & XDP_UMEM_UNALIGNED_CHUNK_FLAG;\n\tu32 chunk_size = mr->chunk_size, headroom = mr->headroom;\n\tunsigned int chunks, chunks_per_page;\n\tu64 addr = mr->addr, size = mr->len;\n\tint size_chk, err;\n\n\tif (chunk_size < XDP_UMEM_MIN_CHUNK_SIZE || chunk_size > PAGE_SIZE) {\n\t\t/* Strictly speaking we could support this, if:\n\t\t * - huge pages, or*\n\t\t * - using an IOMMU, or\n\t\t * - making sure the memory area is consecutive\n\t\t * but for now, we simply say \"computer says no\".\n\t\t */\n\t\treturn -EINVAL;\n\t}\n\n\tif (mr->flags & ~(XDP_UMEM_UNALIGNED_CHUNK_FLAG |\n\t\t\tXDP_UMEM_USES_NEED_WAKEUP))\n\t\treturn -EINVAL;\n\n\tif (!unaligned_chunks && !is_power_of_2(chunk_size))\n\t\treturn -EINVAL;\n\n\tif (!PAGE_ALIGNED(addr)) {\n\t\t/* Memory area has to be page size aligned. For\n\t\t * simplicity, this might change.\n\t\t */\n\t\treturn -EINVAL;\n\t}\n\n\tif ((addr + size) < addr)\n\t\treturn -EINVAL;\n\n\tchunks = (unsigned int)div_u64(size, chunk_size);\n\tif (chunks == 0)\n\t\treturn -EINVAL;\n\n\tif (!unaligned_chunks) {\n\t\tchunks_per_page = PAGE_SIZE / chunk_size;\n\t\tif (chunks < chunks_per_page || chunks % chunks_per_page)\n\t\t\treturn -EINVAL;\n\t}\n\n\tsize_chk = chunk_size - headroom - XDP_PACKET_HEADROOM;\n\tif (size_chk < 0)\n\t\treturn -EINVAL;\n\n\tumem->address = (unsigned long)addr;\n\tumem->chunk_mask = unaligned_chunks ? XSK_UNALIGNED_BUF_ADDR_MASK\n\t\t\t\t\t    : ~((u64)chunk_size - 1);\n\tumem->size = size;\n\tumem->headroom = headroom;\n\tumem->chunk_size_nohr = chunk_size - headroom;\n\tumem->npgs = size / PAGE_SIZE;\n\tumem->pgs = NULL;\n\tumem->user = NULL;\n\tumem->flags = mr->flags;\n\tINIT_LIST_HEAD(&umem->xsk_list);\n\tspin_lock_init(&umem->xsk_list_lock);\n\n\trefcount_set(&umem->users, 1);\n\n\terr = xdp_umem_account_pages(umem);\n\tif (err)\n\t\treturn err;\n\n\terr = xdp_umem_pin_pages(umem);\n\tif (err)\n\t\tgoto out_account;\n\n\tumem->pages = kvcalloc(umem->npgs, sizeof(*umem->pages),\n\t\t\t       GFP_KERNEL_ACCOUNT);\n\tif (!umem->pages) {\n\t\terr = -ENOMEM;\n\t\tgoto out_pin;\n\t}\n\n\terr = xdp_umem_map_pages(umem);\n\tif (!err)\n\t\treturn 0;\n\n\tkvfree(umem->pages);\n\nout_pin:\n\txdp_umem_unpin_pages(umem);\nout_account:\n\txdp_umem_unaccount_pages(umem);\n\treturn err;\n}",
    "func_src_after": "static int xdp_umem_reg(struct xdp_umem *umem, struct xdp_umem_reg *mr)\n{\n\tbool unaligned_chunks = mr->flags & XDP_UMEM_UNALIGNED_CHUNK_FLAG;\n\tu32 chunk_size = mr->chunk_size, headroom = mr->headroom;\n\tunsigned int chunks, chunks_per_page;\n\tu64 addr = mr->addr, size = mr->len;\n\tint err;\n\n\tif (chunk_size < XDP_UMEM_MIN_CHUNK_SIZE || chunk_size > PAGE_SIZE) {\n\t\t/* Strictly speaking we could support this, if:\n\t\t * - huge pages, or*\n\t\t * - using an IOMMU, or\n\t\t * - making sure the memory area is consecutive\n\t\t * but for now, we simply say \"computer says no\".\n\t\t */\n\t\treturn -EINVAL;\n\t}\n\n\tif (mr->flags & ~(XDP_UMEM_UNALIGNED_CHUNK_FLAG |\n\t\t\tXDP_UMEM_USES_NEED_WAKEUP))\n\t\treturn -EINVAL;\n\n\tif (!unaligned_chunks && !is_power_of_2(chunk_size))\n\t\treturn -EINVAL;\n\n\tif (!PAGE_ALIGNED(addr)) {\n\t\t/* Memory area has to be page size aligned. For\n\t\t * simplicity, this might change.\n\t\t */\n\t\treturn -EINVAL;\n\t}\n\n\tif ((addr + size) < addr)\n\t\treturn -EINVAL;\n\n\tchunks = (unsigned int)div_u64(size, chunk_size);\n\tif (chunks == 0)\n\t\treturn -EINVAL;\n\n\tif (!unaligned_chunks) {\n\t\tchunks_per_page = PAGE_SIZE / chunk_size;\n\t\tif (chunks < chunks_per_page || chunks % chunks_per_page)\n\t\t\treturn -EINVAL;\n\t}\n\n\tif (headroom >= chunk_size - XDP_PACKET_HEADROOM)\n\t\treturn -EINVAL;\n\n\tumem->address = (unsigned long)addr;\n\tumem->chunk_mask = unaligned_chunks ? XSK_UNALIGNED_BUF_ADDR_MASK\n\t\t\t\t\t    : ~((u64)chunk_size - 1);\n\tumem->size = size;\n\tumem->headroom = headroom;\n\tumem->chunk_size_nohr = chunk_size - headroom;\n\tumem->npgs = size / PAGE_SIZE;\n\tumem->pgs = NULL;\n\tumem->user = NULL;\n\tumem->flags = mr->flags;\n\tINIT_LIST_HEAD(&umem->xsk_list);\n\tspin_lock_init(&umem->xsk_list_lock);\n\n\trefcount_set(&umem->users, 1);\n\n\terr = xdp_umem_account_pages(umem);\n\tif (err)\n\t\treturn err;\n\n\terr = xdp_umem_pin_pages(umem);\n\tif (err)\n\t\tgoto out_account;\n\n\tumem->pages = kvcalloc(umem->npgs, sizeof(*umem->pages),\n\t\t\t       GFP_KERNEL_ACCOUNT);\n\tif (!umem->pages) {\n\t\terr = -ENOMEM;\n\t\tgoto out_pin;\n\t}\n\n\terr = xdp_umem_map_pages(umem);\n\tif (!err)\n\t\treturn 0;\n\n\tkvfree(umem->pages);\n\nout_pin:\n\txdp_umem_unpin_pages(umem);\nout_account:\n\txdp_umem_unaccount_pages(umem);\n\treturn err;\n}",
    "line_changes": {
        "deleted": [
            {
                "line_no": 7,
                "char_start": 278,
                "char_end": 298,
                "line": "\tint size_chk, err;\n"
            },
            {
                "line_no": 46,
                "char_start": 1202,
                "char_end": 1259,
                "line": "\tsize_chk = chunk_size - headroom - XDP_PACKET_HEADROOM;\n"
            },
            {
                "line_no": 47,
                "char_start": 1259,
                "char_end": 1278,
                "line": "\tif (size_chk < 0)\n"
            }
        ],
        "added": [
            {
                "line_no": 7,
                "char_start": 278,
                "char_end": 288,
                "line": "\tint err;\n"
            },
            {
                "line_no": 46,
                "char_start": 1192,
                "char_end": 1243,
                "line": "\tif (headroom >= chunk_size - XDP_PACKET_HEADROOM)\n"
            }
        ]
    },
    "char_changes": {
        "deleted": [
            {
                "char_start": 283,
                "char_end": 293,
                "chars": "size_chk, "
            },
            {
                "char_start": 1203,
                "char_end": 1204,
                "chars": "s"
            },
            {
                "char_start": 1205,
                "char_end": 1209,
                "chars": "ze_c"
            },
            {
                "char_start": 1210,
                "char_end": 1211,
                "chars": "k"
            },
            {
                "char_start": 1227,
                "char_end": 1238,
                "chars": "headroom - "
            },
            {
                "char_start": 1257,
                "char_end": 1276,
                "chars": ";\n\tif (size_chk < 0"
            }
        ],
        "added": [
            {
                "char_start": 1194,
                "char_end": 1198,
                "chars": "f (h"
            },
            {
                "char_start": 1199,
                "char_end": 1205,
                "chars": "adroom"
            },
            {
                "char_start": 1206,
                "char_end": 1207,
                "chars": ">"
            }
        ]
    },
    "commit_link": "github.com/torvalds/linux/commit/99e3a236dd43d06c65af0a2ef9cb44306aef6e02",
    "file_name": "net/xdp/xdp_umem.c",
    "vul_type": "cwe-787"
}