{
    "func_name": "input_csi_dispatch_sgr_colon",
    "func_src_before": "input_csi_dispatch_sgr_colon(struct input_ctx *ictx, u_int i)\n{\n\tstruct grid_cell\t*gc = &ictx->cell.cell;\n\tchar\t\t\t*s = ictx->param_list[i].str, *copy, *ptr, *out;\n\tint\t\t\t p[8];\n\tu_int\t\t\t n;\n\tconst char\t\t*errstr;\n\n\tfor (n = 0; n < nitems(p); n++)\n\t\tp[n] = -1;\n\tn = 0;\n\n\tptr = copy = xstrdup(s);\n\twhile ((out = strsep(&ptr, \":\")) != NULL) {\n\t\tif (*out != '\\0') {\n\t\t\tp[n++] = strtonum(out, 0, INT_MAX, &errstr);\n\t\t\tif (errstr != NULL || n == nitems(p)) {\n\t\t\t\tfree(copy);\n\t\t\t\treturn;\n\t\t\t}\n\t\t} else\n\t\t\tn++;\n\t\tlog_debug(\"%s: %u = %d\", __func__, n - 1, p[n - 1]);\n\t}\n\tfree(copy);\n\n\tif (n == 0)\n\t\treturn;\n\tif (p[0] == 4) {\n\t\tif (n != 2)\n\t\t\treturn;\n\t\tswitch (p[1]) {\n\t\tcase 0:\n\t\t\tgc->attr &= ~GRID_ATTR_ALL_UNDERSCORE;\n\t\t\tbreak;\n\t\tcase 1:\n\t\t\tgc->attr &= ~GRID_ATTR_ALL_UNDERSCORE;\n\t\t\tgc->attr |= GRID_ATTR_UNDERSCORE;\n\t\t\tbreak;\n\t\tcase 2:\n\t\t\tgc->attr &= ~GRID_ATTR_ALL_UNDERSCORE;\n\t\t\tgc->attr |= GRID_ATTR_UNDERSCORE_2;\n\t\t\tbreak;\n\t\tcase 3:\n\t\t\tgc->attr &= ~GRID_ATTR_ALL_UNDERSCORE;\n\t\t\tgc->attr |= GRID_ATTR_UNDERSCORE_3;\n\t\t\tbreak;\n\t\tcase 4:\n\t\t\tgc->attr &= ~GRID_ATTR_ALL_UNDERSCORE;\n\t\t\tgc->attr |= GRID_ATTR_UNDERSCORE_4;\n\t\t\tbreak;\n\t\tcase 5:\n\t\t\tgc->attr &= ~GRID_ATTR_ALL_UNDERSCORE;\n\t\t\tgc->attr |= GRID_ATTR_UNDERSCORE_5;\n\t\t\tbreak;\n\t\t}\n\t\treturn;\n\t}\n\tif (n < 2 || (p[0] != 38 && p[0] != 48 && p[0] != 58))\n\t\treturn;\n\tswitch (p[1]) {\n\tcase 2:\n\t\tif (n < 3)\n\t\t\tbreak;\n\t\tif (n == 5)\n\t\t\ti = 2;\n\t\telse\n\t\t\ti = 3;\n\t\tif (n < i + 3)\n\t\t\tbreak;\n\t\tinput_csi_dispatch_sgr_rgb_do(ictx, p[0], p[i], p[i + 1],\n\t\t    p[i + 2]);\n\t\tbreak;\n\tcase 5:\n\t\tif (n < 3)\n\t\t\tbreak;\n\t\tinput_csi_dispatch_sgr_256_do(ictx, p[0], p[2]);\n\t\tbreak;\n\t}\n}",
    "func_src_after": "input_csi_dispatch_sgr_colon(struct input_ctx *ictx, u_int i)\n{\n\tstruct grid_cell\t*gc = &ictx->cell.cell;\n\tchar\t\t\t*s = ictx->param_list[i].str, *copy, *ptr, *out;\n\tint\t\t\t p[8];\n\tu_int\t\t\t n;\n\tconst char\t\t*errstr;\n\n\tfor (n = 0; n < nitems(p); n++)\n\t\tp[n] = -1;\n\tn = 0;\n\n\tptr = copy = xstrdup(s);\n\twhile ((out = strsep(&ptr, \":\")) != NULL) {\n\t\tif (*out != '\\0') {\n\t\t\tp[n++] = strtonum(out, 0, INT_MAX, &errstr);\n\t\t\tif (errstr != NULL || n == nitems(p)) {\n\t\t\t\tfree(copy);\n\t\t\t\treturn;\n\t\t\t}\n\t\t} else {\n\t\t\tn++;\n\t\t\tif (n == nitems(p)) {\n\t\t\t\tfree(copy);\n\t\t\t\treturn;\n\t\t\t}\n\t\t}\n\t\tlog_debug(\"%s: %u = %d\", __func__, n - 1, p[n - 1]);\n\t}\n\tfree(copy);\n\n\tif (n == 0)\n\t\treturn;\n\tif (p[0] == 4) {\n\t\tif (n != 2)\n\t\t\treturn;\n\t\tswitch (p[1]) {\n\t\tcase 0:\n\t\t\tgc->attr &= ~GRID_ATTR_ALL_UNDERSCORE;\n\t\t\tbreak;\n\t\tcase 1:\n\t\t\tgc->attr &= ~GRID_ATTR_ALL_UNDERSCORE;\n\t\t\tgc->attr |= GRID_ATTR_UNDERSCORE;\n\t\t\tbreak;\n\t\tcase 2:\n\t\t\tgc->attr &= ~GRID_ATTR_ALL_UNDERSCORE;\n\t\t\tgc->attr |= GRID_ATTR_UNDERSCORE_2;\n\t\t\tbreak;\n\t\tcase 3:\n\t\t\tgc->attr &= ~GRID_ATTR_ALL_UNDERSCORE;\n\t\t\tgc->attr |= GRID_ATTR_UNDERSCORE_3;\n\t\t\tbreak;\n\t\tcase 4:\n\t\t\tgc->attr &= ~GRID_ATTR_ALL_UNDERSCORE;\n\t\t\tgc->attr |= GRID_ATTR_UNDERSCORE_4;\n\t\t\tbreak;\n\t\tcase 5:\n\t\t\tgc->attr &= ~GRID_ATTR_ALL_UNDERSCORE;\n\t\t\tgc->attr |= GRID_ATTR_UNDERSCORE_5;\n\t\t\tbreak;\n\t\t}\n\t\treturn;\n\t}\n\tif (n < 2 || (p[0] != 38 && p[0] != 48 && p[0] != 58))\n\t\treturn;\n\tswitch (p[1]) {\n\tcase 2:\n\t\tif (n < 3)\n\t\t\tbreak;\n\t\tif (n == 5)\n\t\t\ti = 2;\n\t\telse\n\t\t\ti = 3;\n\t\tif (n < i + 3)\n\t\t\tbreak;\n\t\tinput_csi_dispatch_sgr_rgb_do(ictx, p[0], p[i], p[i + 1],\n\t\t    p[i + 2]);\n\t\tbreak;\n\tcase 5:\n\t\tif (n < 3)\n\t\t\tbreak;\n\t\tinput_csi_dispatch_sgr_256_do(ictx, p[0], p[2]);\n\t\tbreak;\n\t}\n}",
    "line_changes": {
        "deleted": [
            {
                "line_no": 21,
                "char_start": 485,
                "char_end": 494,
                "line": "\t\t} else\n"
            }
        ],
        "added": [
            {
                "line_no": 21,
                "char_start": 485,
                "char_end": 496,
                "line": "\t\t} else {\n"
            },
            {
                "line_no": 23,
                "char_start": 504,
                "char_end": 529,
                "line": "\t\t\tif (n == nitems(p)) {\n"
            },
            {
                "line_no": 24,
                "char_start": 529,
                "char_end": 545,
                "line": "\t\t\t\tfree(copy);\n"
            },
            {
                "line_no": 25,
                "char_start": 545,
                "char_end": 557,
                "line": "\t\t\t\treturn;\n"
            },
            {
                "line_no": 26,
                "char_start": 557,
                "char_end": 562,
                "line": "\t\t\t}\n"
            },
            {
                "line_no": 27,
                "char_start": 562,
                "char_end": 566,
                "line": "\t\t}\n"
            }
        ]
    },
    "char_changes": {
        "deleted": [],
        "added": [
            {
                "char_start": 493,
                "char_end": 495,
                "chars": " {"
            },
            {
                "char_start": 503,
                "char_end": 565,
                "chars": "\n\t\t\tif (n == nitems(p)) {\n\t\t\t\tfree(copy);\n\t\t\t\treturn;\n\t\t\t}\n\t\t}"
            }
        ]
    },
    "commit_link": "github.com/tmux/tmux/commit/a868bacb46e3c900530bed47a1c6f85b0fbe701c",
    "file_name": "input.c",
    "vul_type": "cwe-787"
}